{
  "adoption_verifier": "evals/agentic/tasks/_verifiers/verify_adoption.py",
  "capabilities": [
    {
      "generic_equivalent": "proceed on the plan directly with no stakes-tiered interview or recap",
      "kind": "skill",
      "name": "grill-me stakes-tiered interview loop",
      "source_plugin": "grill-me"
    }
  ],
  "card_id": "grill-me-neg-01",
  "expected_boundary_verdict": "",
  "fail_fixture": "evals/agentic/tasks/grill-me/grill-me-neg-01/fixtures/fail",
  "holdout": false,
  "kind": "negative",
  "mutations": [
    "delete-guard-line",
    "comment-out-check"
  ],
  "outcome_verifier": "evals/agentic/tasks/_verifiers/verify_outcome.py",
  "pass_fixture": "evals/agentic/tasks/grill-me/grill-me-neg-01/fixtures/pass",
  "plugin": "grill-me",
  "task_path": "evals/agentic/tasks/grill-me/grill-me-neg-01/task"
}
