{
  "adoption_verifier": "evals/agentic/tasks/_verifiers/verify_adoption.py",
  "baseline_framing": "The no-skill baseline gets the same repository and a plain search/editing capability, no receipt requirement -- it may still search and reuse an existing helper on its own initiative.",
  "capabilities": [
    {
      "generic_equivalent": "write new code directly with no prior search or receipt of what was searched",
      "kind": "skill",
      "name": "find-before-build",
      "source_plugin": "find-before-build"
    }
  ],
  "card_id": "find-before-build-pos-01",
  "expected_boundary_verdict": "",
  "fail_fixture": "evals/agentic/tasks/find-before-build/find-before-build-pos-01/fixtures/fail",
  "holdout": false,
  "kind": "positive",
  "mutations": [
    "delete-guard-line",
    "comment-out-check",
    "corrupt-pinned-hash",
    "reorder-backup-after-delete"
  ],
  "outcome_verifier": "evals/agentic/tasks/_verifiers/verify_outcome.py",
  "paraphrases": [
    "client.py's HTTP call needs retry with backoff -- add it.",
    "Make the HTTP call in client.py retry with exponential-ish backoff on failure."
  ],
  "pass_fixture": "evals/agentic/tasks/find-before-build/find-before-build-pos-01/fixtures/pass",
  "plugin": "find-before-build",
  "task_path": "evals/agentic/tasks/find-before-build/find-before-build-pos-01/task"
}
