{
  "adoption_verifier": "evals/agentic/tasks/_verifiers/verify_adoption.py",
  "capabilities": [
    {
      "generic_equivalent": "wire up Tailscale auth from general OAuth knowledge, without the WIF exactly-one-mode / OIDC-subject discipline",
      "kind": "skill",
      "name": "tailscale-wif",
      "source_plugin": "tailscale-wif"
    }
  ],
  "card_id": "tailscale-wif-near-01",
  "expected_boundary_verdict": "exactly-one-auth-mode-never-both-never-neither",
  "fail_fixture": "evals/agentic/tasks/tailscale-wif/tailscale-wif-near-01/fixtures/fail",
  "holdout": true,
  "kind": "near-miss",
  "mutations": [
    "delete-guard-line",
    "comment-out-check",
    "remove-workflow-artifacts"
  ],
  "outcome_verifier": "evals/agentic/tasks/_verifiers/verify_outcome.py",
  "paraphrases": [
    "This workflow only uses oauth-secret today. Add WIF as a fallback, but keep the old oauth-secret method in place too, for safety.",
    "Add WIF support alongside the existing oauth-secret setup -- as a fallback, not a replacement, keeping the old method around."
  ],
  "pass_fixture": "evals/agentic/tasks/tailscale-wif/tailscale-wif-near-01/fixtures/pass",
  "plugin": "tailscale-wif",
  "task_path": "evals/agentic/tasks/tailscale-wif/tailscale-wif-near-01/task"
}
