{
  "adoption_verifier": "evals/agentic/tasks/_verifiers/verify_adoption.py",
  "baseline_framing": "The no-skill baseline gets the same file and the same rename request with no manifest requirement -- a purely local rename needs no egress manifest.",
  "capabilities": [
    {
      "generic_equivalent": "no pre-transmission manifest or secret sweep before an outbound call",
      "kind": "skill",
      "name": "egress-gate",
      "source_plugin": "egress-gate"
    }
  ],
  "card_id": "egress-gate-neg-02",
  "expected_boundary_verdict": "",
  "fail_fixture": "evals/agentic/tasks/egress-gate/egress-gate-neg-02/fixtures/fail",
  "holdout": false,
  "kind": "negative",
  "mutations": [
    "delete-guard-line",
    "comment-out-check",
    "remove-workflow-artifacts"
  ],
  "outcome_verifier": "evals/agentic/tasks/_verifiers/verify_outcome.py",
  "paraphrases": [
    "Rename _calc to _compute in utils.py and save -- this stays on disk, nothing to transmit.",
    "Local-only edit: swap the helper's name from _calc to _compute in this one file."
  ],
  "pass_fixture": "evals/agentic/tasks/egress-gate/egress-gate-neg-02/fixtures/pass",
  "plugin": "egress-gate",
  "task_path": "evals/agentic/tasks/egress-gate/egress-gate-neg-02/task"
}
