{
  "adoption_verifier": "evals/agentic/tasks/_verifiers/verify_adoption.py",
  "capabilities": [
    {
      "generic_equivalent": "answer directly from the model's own unaided judgment, with no adversarial re-check step and no per-dimension structured output",
      "kind": "skill",
      "name": "orchestrate",
      "source_plugin": "orchestrate"
    }
  ],
  "card_id": "orchestrate-neg-01",
  "expected_boundary_verdict": "",
  "fail_fixture": "evals/agentic/tasks/orchestrate/orchestrate-neg-01/fixtures/fail",
  "holdout": false,
  "kind": "negative",
  "mutations": [
    "delete-guard-line",
    "comment-out-check",
    "remove-workflow-artifacts"
  ],
  "outcome_verifier": "evals/agentic/tasks/_verifiers/verify_outcome.py",
  "pass_fixture": "evals/agentic/tasks/orchestrate/orchestrate-neg-01/fixtures/pass",
  "plugin": "orchestrate",
  "task_path": "evals/agentic/tasks/orchestrate/orchestrate-neg-01/task"
}
